{
  "$schema": "https://json-schema.org/draft/2020-12/schema",
  "$id": "https://github.com/8Dionysus/aoa-techniques/mechanics/experience/parts/appeal-reasoning/schemas/appeal_reasoning_step_v1.json",
  "title": "Appeal Reasoning Step V1",
  "type": "object",
  "additionalProperties": false,
  "required": [
    "authority",
    "created_at",
    "decision_refs",
    "evidence_refs",
    "id",
    "kind",
    "notes",
    "requires_trace",
    "schema_version",
    "status",
    "step"
  ],
  "properties": {
    "authority": {
      "type": "object",
      "additionalProperties": false,
      "required": [
        "actor",
        "mode"
      ],
      "properties": {
        "actor": {
          "type": "string",
          "minLength": 1
        },
        "mode": {
          "type": "string",
          "minLength": 1,
          "enum": [
            "reviewed"
          ]
        }
      }
    },
    "created_at": {
      "type": "string",
      "minLength": 1
    },
    "decision_refs": {
      "type": "array",
      "items": {
        "type": "string",
        "minLength": 1
      }
    },
    "evidence_refs": {
      "type": "array",
      "items": {
        "type": "string",
        "minLength": 1
      },
      "minItems": 1
    },
    "id": {
      "type": "string",
      "minLength": 1
    },
    "kind": {
      "type": "string",
      "minLength": 1,
      "const": "technique.appeal_reasoning_step"
    },
    "notes": {
      "type": "array",
      "items": {
        "type": "string",
        "minLength": 1
      },
      "minItems": 1
    },
    "requires_trace": {
      "type": "boolean",
      "const": true
    },
    "schema_version": {
      "type": "string",
      "minLength": 1,
      "const": "v1"
    },
    "status": {
      "type": "string",
      "minLength": 1,
      "enum": [
        "proposed"
      ]
    },
    "step": {
      "type": "string",
      "minLength": 1
    }
  }
}
