{
  "authority": {
    "actor": "operator.sovereign",
    "mode": "reviewed"
  },
  "created_at": "2026-04-22T12:00:00-06:00",
  "decision_refs": [],
  "evidence_refs": [
    "receipt:example:001"
  ],
  "id": "technique.appeal_reasoning_step.example.001",
  "kind": "technique.appeal_reasoning_step",
  "notes": [
    "seed example for v0.8 polis governance"
  ],
  "requires_trace": true,
  "schema_version": "v1",
  "status": "proposed",
  "step": "compare_omitted_evidence"
}
